{
  "version": 1,
  "revision": 0,
  "focusRecordId": "11111111-1111-4111-8111-111111111111",
  "records": [
    {
      "recordId": "11111111-1111-4111-8111-111111111111",
      "origin": {
        "kind": "local"
      },
      "curriculumId": "fixture-course",
      "title": "Prediction practice",
      "status": "active",
      "revision": 0,
      "selectedModuleId": "baseline"
    }
  ]
}
